platform,url,account,account_id,media_title,media_length
Daily Motion,https://www.dailymotion.com/video/x3zdz1b,Nursery Rhymes,,Dora The Explorer Finger Family Nursery Rhymes Lyrics,
Daily Motion,https://www.dailymotion.com/video/x4gfstk,Peppa Pig Opening,,Peppa Pig Teletubbies 3D Finger Family | Nursery Rhymes | Five Finger Channel,
Daily Motion,https://www.dailymotion.com/video/x50dhk4,Porezic,,Teletubbies Finger Family / Nursery Rhymes,
Daily Motion,https://www.dailymotion.com/video/x50xj2j,Fabacal,,Teletubbies a la Minion finger family - nursery rhyme for kids,
Daily Motion,https://www.dailymotion.com/video/x51qjdf,Jonathanbarter32,,Incredibles Finger Family / Nursery Rhymes,
Daily Motion,https://www.dailymotion.com/video/x51u6cw,Kaden,,African Wild Animals Finger Family Nursery Rhymes Lyrics,
Daily Motion,https://www.dailymotion.com/video/x53e8yi,Wilburscrivener89,,"Elephant Finger Family | Dumbo, Lumpy, Horton, Ding Dong | and more Nursery Rhymes | dRuLii TV",
Daily Motion,https://www.dailymotion.com/video/x53pw1r,Joancoupe19,,African Animals Finger Family Nursery Rhymes Lyrics,
Daily Motion,https://www.dailymotion.com/video/x53qnju,Reginagravil45,,Berry Bitty Adventures Finger Family Nursery Rhymes Lyrics,
Daily Motion,https://www.dailymotion.com/video/x54fydc,Kukuxu,,Kung Fu Panda Finger Family | BingBing TV - Nursery Rhymes For Children,
Daily Motion,https://www.dailymotion.com/video/x55s5jn,Xumoyodoya,,Jungle Junction Finger Family | BingBing TV - Nursery Rhymes For Children,
Daily Motion,https://www.dailymotion.com/video/x563xic,Muwujulomi,,Lion King Finger Family Nursery Rhyme for Children - Kids Songs - Lion King Finger Family,
Daily Motion,https://www.dailymotion.com/video/x567unw,Valeriecottingham89,,"Mouse finger family | Mickey, Jerry, Minnie | Nursery Rhymes for kids",
Daily Motion,https://www.dailymotion.com/video/x56af0y,Herbertcowin26,,Finger Family Bear | Cartoon & Real Animals song for children,
Daily Motion,https://www.dailymotion.com/video/x57kmon,Beatricewaters34,,"Winnie the Pooh Finger Family Song | Tigger, Piglet, Roo, Eeyore & Pooh Nursery Rhymes for kids",
Daily Motion,https://www.dailymotion.com/video/x57xvo9,Rudolphwise15,,"Wild Animals Finger Family | Lion, Tiger, Wolf, Panther, Hyena | Nursery Song for kids",
Daily Motion,https://www.dailymotion.com/video/x587si4,Yubuvoreru,,BEN 10 Finger Family - Nursery Rhymes for Children and Babies by MY FINGER FAMILY RHYMES,
Daily Motion,https://www.dailymotion.com/video/x58f5aa,Sumameca,,Dino Finger Family Nursery Rhymes Lyrics,
Daily Motion,https://www.dailymotion.com/video/x58mqvq,Magdelinamclaughlin85,,"Paw Patrol Finger Family Surprise Eggs | Chase, Rocky, Skye | Transform into Super Heroes",
Daily Motion,https://www.dailymotion.com/video/x59kptr,Susanlane80,,Finger Family - CAT FAMILY | Nursery Rhymes Animated cartoons for kids,
Daily Motion,https://www.dailymotion.com/video/x3bmgdr,Pejibolezu,,INSIDE OUT Cartoons Finger Family Children Nursery Rhymes | Inside Out Finger Family Rhyme,
Daily Motion,https://www.dailymotion.com/video/x3ewkwz,Nursery Rhymes,,Subway Surfers Finger Family | Nursery Rhymes | Little Rhymes Official,
Daily Motion,https://www.dailymotion.com/video/x3ezbyr,Pejibolezu,,Inside Out Cartoons For Children Finger Family Nursery Rhymes | Inside Out Finger Family R,
Daily Motion,https://www.dailymotion.com/video/x3k5uhv,Stefjop,,Lion King Finger Family Nursery Rhymes | Lion King Cartoon Finger Family Rhyme for Childre,
Daily Motion,https://www.dailymotion.com/video/x3neqyp,HİTS SERİES 28,,Inside Out Finger Family Nursery Rhymes Lyrics,
Daily Motion,https://www.dailymotion.com/video/x3qe31b,Team Umizoomi,,Play Doh Teletubbies Finger Family Nursey Rhyme Song,
Daily Motion,https://www.dailymotion.com/video/x3qeo9v,Nursery Ryhme,,Teletubbies Finger Family | Nursery Rhymes | 3D Animation In HD From Binggo Channel,
Daily Motion,https://www.dailymotion.com/video/x3r0qs2,Theodoreforsythe33,,Ice Age Finger Family / Nursery Rhymes,
Daily Motion,https://www.dailymotion.com/video/x3r2pcf,Katherinetrollope44,,Africans Wild Animals Finger Family / Nursery Rhymes,
Daily Motion,https://www.dailymotion.com/video/x3r2t4k,Charlesbuttery70,,Animals 3D Finger Family / Nursery Rhymes,
Daily Motion,https://www.dailymotion.com/video/x3rofsc,Bizibuco,,Spiderman Finger Family Nursery Rhymes Lyrics,
Daily Motion,https://www.dailymotion.com/video/x3rxgrr,Victoriaboldberg67,,Zebra Finger Family Nursery Rhymes Lyrics,
Daily Motion,https://www.dailymotion.com/video/x3sialn,Rinace,,Minions Finger Family Nursery Rhymes Lyrics,
Daily Motion,https://www.dailymotion.com/video/x3t33ye,Shirleyscroop16,,Best Finger Family Collection Nursery Rhymes Lyrics,
Daily Motion,https://www.dailymotion.com/video/x3tdg0l,Zoxulegi,,Sheriff Callies Wild West Finger Family Nursery Rhymes Lyrics,
Daily Motion,https://www.dailymotion.com/video/x3ti4mi,Nepipux,,Teletubbies 3D Finger Family Nursery Rhymes Lyrics,
Daily Motion,https://www.dailymotion.com/video/x3tjyw8,Tugi,,Ice Age Finger Family Nursery Rhymes Lyrics,
Daily Motion,https://www.dailymotion.com/video/x3u2055,Yanucokuna,,Rio 2 Finger Family Nursery Rhymes Lyrics,
Daily Motion,https://www.dailymotion.com/video/x3x3mxn,Elsaglyons8491,,★ INSIDE OUT ★ Finger Family Nursery Rhymes Cartoon for Children Family Song,
Daily Motion,https://www.dailymotion.com/video/x3xc2q2,Nursery Rhymes,,Finger Family Song! Disney Pixars Inside Out Nursery Rhyme!,
Daily Motion,https://www.dailymotion.com/video/x6ugjrs,HahnfeldWade8184,,Doc McStuffins Finger Family Nursery Rhymes and more Lyrics,
Daily Motion,https://www.dailymotion.com/video/x9csd2k,Aaliyah Rosado,,My Little Pony G4: Pinkie Pie's Rainbow Reflection Video!,
Daily Motion,https://www.dailymotion.com/video/x8sbs9a,Calvin Jacks,,My Little Pony Equestria Girls Rainbow Rocks End Credits (2014),
Daily Motion,https://www.dailymotion.com/video/x9hw7kk,Cheche Toirac Travel,,Little Pony Adventures | Canción Infantil para Niños,
Daily Motion,https://www.dailymotion.com/video/x44h39c,Peppa Pig Theme Song,,3 Things Sings The Peppa Pig Theme Song,
Daily Motion,https://www.dailymotion.com/video/x9kzh1o,G,,22 Things Sings The Peppa Pig Theme Song,
Daily Motion,https://www.dailymotion.com/video/x3d3ruv,Kısa Videolar,,[Song] Sisterhood - My little Pony (Brotherhooves Social),
Daily Motion,https://www.dailymotion.com/video/x3d8a5q,Kısa Videolar,,[Song] My Little Pony: FiM: The Vote,
Daily Motion,https://www.dailymotion.com/video/x8da9d4,Kobe Reed,,My Little Pony_ Friendship Is Magic - Theme Song Horror Version  Reversed.mp4,
Daily Motion,https://www.dailymotion.com/video/x8dmaa6,Kobe Reed,,My Little Pony Friendship is Magic Theme Song Horror Version,
Daily Motion,https://www.dailymotion.com/video/x59ku7o,Cynthiakoe10,,"Paw Patrol Finger Family Songs | Chase, Rubble, Skye, Marshall | Nursery Rhymes and more",
Daily Motion,https://www.dailymotion.com/video/x59xp27,Joannagarth75,,"Monkeys Finger Family Song | Abu, George, Rafiki, Boots | Apes Nursery Rhymes for kids",
Daily Motion,https://www.dailymotion.com/video/x5a4998,Calvinearnshaw21,,Frozen Finger Family Song Nursery Rhymes Lyrics,
Daily Motion,https://www.dailymotion.com/video/x5ahkmq,Edwinowens53,,Lion King Finger Family Nursery Rhymes Lyrics,
Daily Motion,https://www.dailymotion.com/video/x5azrhf,Fewo,,SpongeBob SquarePants Finger Family Song | Nursery Rhymes COLLECTION Real Life for kids,
Daily Motion,https://www.dailymotion.com/video/x5b0xy2,Pibeco,,Wild Animals 3D Finger Family Nursery Rhymes Lyrics,
Daily Motion,https://www.dailymotion.com/video/x5c01vq,Williamilonka38,,Horses Finger Family Song | With Cartoon & Real Horses | Nursery Rhymes for kids,
Daily Motion,https://www.dailymotion.com/video/x5clvfh,Madelinefern30,,Inside Out Finger Family Numbers Nursery Rhymes Lyrics and more,
Daily Motion,https://www.dailymotion.com/video/x5ctz9h,Lavonnakamala 5845,,Wild Animals Finger Family Nursery Rhymes Lyrics,
Daily Motion,https://www.dailymotion.com/video/x5duwwz,Derickgallon44,,Teletubbies Finger Family Songs Collection party,
Daily Motion,https://www.dailymotion.com/video/x9g9988,My Little Pony And Friends,,MY LITTLE PONY-THE MOVIE(OPENING MULTILANGUAGE COMPARISON REMASTERED),
Daily Motion,https://www.dailymotion.com/video/x9liaam,My Little Pony And Friends,,Mijn Kleine Pony-Het spook van Paradise Estate(REMASTERED),
Daily Motion,https://www.dailymotion.com/video/x6ght3b,Myysseli Doge YT,,My Little Pony: Venskab er ren magi - Op På Mærkerne (dansk),
Daily Motion,https://www.dailymotion.com/video/x6h6k1h,Myysseli Doge YT,,"My Little Pony: Sunset Shimmerin Saga - Todennäköisin Unohdettu, osa 1 (suomi)",
Daily Motion,https://www.dailymotion.com/video/x354sxq,Peppa Pig Intro,,Peppa Pig Intro,
Daily Motion,https://www.dailymotion.com/video/x365ag9,Peppa Pig Intro,,Peppa Pig Intro Video SD,
Daily Motion,https://www.dailymotion.com/video/x36sna3,Peppa Pig Intro,,Peppa Pig Intro,
Daily Motion,https://www.dailymotion.com/video/x4hpej0,Peppa Pig Intro,,Peppa Pig intro 2K15,
Daily Motion,https://www.dailymotion.com/video/x3505cv,Peppa Pig S,,finger family | pappa pig finger family | daddy finger daddy finger,
Daily Motion,https://www.dailymotion.com/video/x4f0dq1,Peppa Pig S,,Finger Family || Peppa Pig Family || Pigs Version || Daddy Finger Rhyme || Kids Nursery Rhymes,
Daily Motion,https://www.dailymotion.com/video/x5e4tyn,Jurixocem,,Learn Colors Disney Cars Finger Family Nursery Rhymes Kids Children Play Doh Ice Cream Sur,
Daily Motion,https://www.dailymotion.com/video/x5e4xxg,Richardgunnel54,,Dinosaurs Finger Family Song | Nursery Rhymes | Dinosaur for Kids,
Daily Motion,https://www.dailymotion.com/video/x5e50tk,Aldrichcormack75,,Zebra Finger Family Nursery Rhymes Lyrics,
Daily Motion,https://www.dailymotion.com/video/x5el1sr,Vohimowew,,Inside Out Finger Family Numbers Nursery Rhymes Lyrics and more,
Daily Motion,https://www.dailymotion.com/video/x5fd03b,Venarocuf,,"Elephant Finger Family | Dumbo, Lumpy, Horton, Ding Dong | and more Nursery Rhymes | dRuLi",
Daily Motion,https://www.dailymotion.com/video/x61trba,Theodoreforsythe33,,"Halloween Finger Family | Mickey, Donald, Minnie, Goofy | Nursery Rhymes Surprise Eggs",
Daily Motion,https://www.dailymotion.com/video/x66i2ye,Kid Club,,Finger Family Song Teletubbies Family Nursery Rhyme,
Daily Motion,https://www.dailymotion.com/video/x6fqs8y,andraconsuela6917,,#Inside Out #Finger #Family #Nursery #Rhymes #Lyrics and more,
Daily Motion,https://www.dailymotion.com/video/x6ou2e3,idaedna2482,,LION SIMBA Animal Finger Family | Finger Family Song | 2D Animation Nursery Rhymes & Songs for Child,
Daily Motion,https://www.dailymotion.com/video/x6r725g,jarredjustin8307,,Teletubbies Finger Family Nursery Rhymes,
Daily Motion,https://www.dailymotion.com/video/x34q8id,Peppa Pig S Christmas,,Peppa Pig Cartoon Finger Family Nursery Rhymes _ Peppa Pig Finger Family Children Nursery Rhymes,
Daily Motion,https://www.dailymotion.com/video/x33rkh9,Peppa Pig Song,,Finger Family Song Peppa Pig Daddy Finger Finger Family Song,
Daily Motion,https://www.dailymotion.com/video/x356gy6,Peppa Pig Song,,Паравозик дедушки. Свинка Пеппа./Grandfathers train Song. Peppa Pig,
Daily Motion,https://www.dailymotion.com/video/x35yf0u,Peppa Pig Song,,"Peppa Pig Finger Family Nursery Rhymes, Finger Family",
Daily Motion,https://www.dailymotion.com/video/x35yfa1,Peppa Pig Song,,MLG Peppa Pig,
Daily Motion,https://www.dailymotion.com/video/x43ghil,Peppa Pig Song,,Peppa Pig Cartoon Song - Old macdonald had a farm More Nursery Rhymes,
Daily Motion,https://www.dailymotion.com/video/x4595i3,Peppa Pig Song,,Peppa Pig Lollipop Finger Family Nursery Rhymes with Lyrics Song for Children PeppaPig Daddy finger,
Daily Motion,https://www.dailymotion.com/video/x4aus65,Peppa Pig Song,,Peppa Pig Lollipop Finger Family Song PeppaPig Nursery Rhymes The Pig Family LullaBabies,
Daily Motion,https://www.dailymotion.com/video/x4b2o68,Peppa Pig Song,,Peppa Pig Finger Family Song Peppa Pig Toys Daddy Finger Ty Beanie Babies Nursery Rhyme,
Daily Motion,https://www.dailymotion.com/video/x4cigyv,Peppa Pig Song,,Finger Family PEPPA PIG Friends (familia dedos / amigos peppa la cerdita),
Daily Motion,https://www.dailymotion.com/video/x4dcud9,Peppa Pig Song,,Ice Cream Finger Family Peppa Pig ♪ Nursery Rhymes For Children ♪ Kids TV ♪ #1,
Daily Motion,https://www.dailymotion.com/video/x4djbls,Peppa Pig Song,,Peppa Pig Frozen Finger Family Nursery Rhymes Lyrics and More Daddy Finger Song video snippet,
Daily Motion,https://www.dailymotion.com/video/x4ea1f7,Peppa Pig Song,,Peppa Pig Funny Finger Family Nursery Rhymes by Antonclaten,
Daily Motion,https://www.dailymotion.com/video/x4f5fp1,Peppa Pig Song,,Peppa Pig Shopping Finger Family nursery rhyme,
Daily Motion,https://www.dailymotion.com/video/x4f9q4r,Peppa Pig Song,,Finger Family Nursery Rhymes Toy Story Finger Family Songs Daddy Finger Songs Peppa pig,
Daily Motion,https://www.dailymotion.com/video/x4hrhf0,Peppa Pig Song,,Peppa Pig finger family song,
Daily Motion,https://www.dailymotion.com/video/x4i0oih,Peppa Pig Song,,ABC Song Bus Song New 2016   Peppa Pig Drawing Birthday Party Finger Family Song!,
Daily Motion,https://www.dailymotion.com/video/x43gh6p,Peppa Pig Spanish Episodes,,Peppa Pig Intro Instrumental with Animax En HD,
Daily Motion,https://www.dailymotion.com/video/x4hm32a,Peppa Pig What Are Those,,#Peppa Pig #Sea #Play #Finger Family / #Nursery Rhymes Lyrics and More,
Daily Motion,https://www.dailymotion.com/video/x3atnrq,Sara Claire,,Right There In Front Of Me MLP: Equestria Girls – Friendship Games! [HD],
