platform,url,account,account_id,media_title,media_length
Daily Motion,https://www.dailymotion.com/video/x3rtixb,Nijidahuk,,Thomas & Friends Finger Family Nursery Rhyme Song,
Daily Motion,https://www.dailymotion.com/video/x3rtiy7,Nijidahuk,,Miles from Tomorrowland Finger Family Nursery Rhymes Lyrics,
Daily Motion,https://www.dailymotion.com/video/x3rtizr,Nijidahuk,,In The Night Garden - Finger Family Song - In The Night Garden Toys,
Daily Motion,https://www.dailymotion.com/video/x3rtj07,Nijidahuk,,Play Doh Pocoyo Finger Family Song Nursery Rhymes for Children and Kids,
Daily Motion,https://www.dailymotion.com/video/x3rtj25,Nijidahuk,,Finger Family Nursery Rhymes,
Daily Motion,https://www.dailymotion.com/video/x3rtj27,Nijidahuk,,Phineas & Ferb Finger Family | Favorite song | Nursery Rhymes | Balloon,
Daily Motion,https://www.dailymotion.com/video/x3rzlda,Nijidahuk,,Finger Family Mix Up Angry Birds Peppa Pig Thomas & Friends Little Einsteins Disney Frozen,
Daily Motion,https://www.dailymotion.com/video/x3rznz6,Nijidahuk,,Scary Pumpkin Finger Family Song | Halloween Nursery Rhyme,
Daily Motion,https://www.dailymotion.com/video/x3rzp1h,Nijidahuk,,Play-Doh Teletubbies Meadow Finger Family Nursery Rhyme Song,
Daily Motion,https://www.dailymotion.com/video/x3rzpnf,Nijidahuk,,Paw Patrol Finger Family Nursery Rhymes By EKids,
Daily Motion,https://www.dailymotion.com/video/x3r5ii8,Nijidahuk,,Teletubbies Finger Family Song with Play Doh Nursery Rhyme,
Daily Motion,https://www.dailymotion.com/video/x3rdsxb,Nijidahuk,,Play-Doh Teletubbies Finger Family Nursery Rhyme Song,
Daily Motion,https://www.dailymotion.com/video/x3rdtfd,Nijidahuk,,Winnie-the-Pooh Finger Family Nursery Rhymes Lyrics,
Daily Motion,https://www.dailymotion.com/video/x3rdui9,Nijidahuk,,FURBY Toys - Finger Family Song [Nursery Rhyme] Toy PARODY | Finger Family Fun,
Daily Motion,https://www.dailymotion.com/video/x3rduz0,Nijidahuk,,Finger Family Shark Family Nursery Rhyme | Animal Finger Family | Fish Finger Family for c,
Daily Motion,https://www.dailymotion.com/video/x3rdvp1,Nijidahuk,,Little Einsteins Finger Family Nursery Rhyme Song,
Daily Motion,https://www.dailymotion.com/video/x3rdvr0,Nijidahuk,,The Finger Family Butterfly Family Nursery Rhymes | Butterfly Finger Family Songs,
Daily Motion,https://www.dailymotion.com/video/x3rdw5e,Nijidahuk,,Vegetables Finger Family | Nursery Rhymes From kids Tv,
Daily Motion,https://www.dailymotion.com/video/x3rdx97,Nijidahuk,,Finger Family | Play Doh Spongebob Squarepants Finger Family Nursery Rhyme Song,
Daily Motion,https://www.dailymotion.com/video/x3rl19j,Nijidahuk,,The Finger Family Cup Cakes Family Nursery Rhyme | Cup Cakes Finger Family Songs,
Daily Motion,https://www.dailymotion.com/video/x3adonu,Fran,,Peppa Pig Play Doh Finger Family Song,
Daily Motion,https://www.dailymotion.com/video/x3r5hv3,Nijidahuk,,Tayo the little Bus Finger Family Song Parody Nursery Rhyme,
Daily Motion,https://www.dailymotion.com/video/x3r5hyb,Nijidahuk,,Shopkins Finger Family Nursery Rhymes for Children,
Daily Motion,https://www.dailymotion.com/video/x3r5hzk,Nijidahuk,,Henry Hugglemonster Finger Family Song,
Daily Motion,https://www.dailymotion.com/video/x3r5hzp,Nijidahuk,,BARNEY & Friends - Finger Family Song [Nursery Rhyme] Toy PARODY Episode | Finger Family F,
Daily Motion,https://www.dailymotion.com/video/x3r5hzt,Nijidahuk,,Peppa Pig Inside Out Bubble Guppies Paw Patrol Finger Family Nursery Rhyme Song,
Daily Motion,https://www.dailymotion.com/video/x3r5i06,Nijidahuk,,CHLOES CLOSET Finger Family Song Nursery Rhyme Toy PARODY Episode,
Daily Motion,https://www.dailymotion.com/video/x3r5i1g,Nijidahuk,,Finger Family Nursery Rhymes,
Daily Motion,https://www.dailymotion.com/video/x3r5ier,Nijidahuk,,Yo Gabba Gabba Finger Family | Munos Play Doh Family Nursery Rhyme Song,
Daily Motion,https://www.dailymotion.com/video/x3r5ig7,Nijidahuk,,Ice Age Finger Family Songs - Daddy Finger Nursery Rhymes Collection for kids toddlers,
Daily Motion,https://www.dailymotion.com/video/x3rl1vb,Nijidahuk,,Minecraft Finger Family - Minecraft Nursery Rhyme Song,
Daily Motion,https://www.dailymotion.com/video/x3rl20g,Nijidahuk,,Finger Family | Play Doh Sesame Street Finger Family Nursery Rhyme Song,
Daily Motion,https://www.dailymotion.com/video/x3rl3q5,Nijidahuk,,Finger Family Mickey Mouse Song | Disney Nursery Rhymes Minnie Kids Songs,
Daily Motion,https://www.dailymotion.com/video/x3rl49d,Nijidahuk,,Tom and Jerry Finger Family Song Lollipop Play Doh Nursery Rhyme,
Daily Motion,https://www.dailymotion.com/video/x3rma0v,Eldoracasson57,,"Superhero Finger Family Song! Finger Family Superheroes, Finger Family Song Playlist, Finger Family",
Daily Motion,https://www.dailymotion.com/video/x3rs08v,Nijidahuk,,"Nickelodeon Animation Finger Family || Peppa Pig, Spongebob, Dora, Paw Patrol, Blaze Songs",
Daily Motion,https://www.dailymotion.com/video/x3rs0fa,Nijidahuk,,The Finger Family Team Umizoomi - Family Nursery Rhyme - Team Umizoomi Finger Family Songs,
Daily Motion,https://www.dailymotion.com/video/x3rs0nv,Nijidahuk,,Finger Family Song TMNT Teenage Mutant Ninja Turtles Nursery Rhyme,
Daily Motion,https://www.dailymotion.com/video/x3rs0o8,Nijidahuk,,FINGER FAMILY SONG ♫ | Nursery Rhyme | Pancake Manor,
Daily Motion,https://www.dailymotion.com/video/x3rs0p0,Nijidahuk,,"Finger Family Song - Mega Finger Family Collection! Frozen, Minions, Elmo, Nursery Rhymes",
Daily Motion,https://www.dailymotion.com/video/x3sg63f,Nijidahuk,,Masha and the Bear Finger Family Nursery Rhyme Song,
Daily Motion,https://www.dailymotion.com/video/x3sg66a,Nijidahuk,,POKEMON Finger Family Nursery Rhymes Pokemon Finger Family Songs Daddy Finger Squirtle,
Daily Motion,https://www.dailymotion.com/video/x3sg66z,Nijidahuk,,TOY STORY Finger Family Nursery Rhymes Cake Pops Toy Story Finger Family Songs Daddy Finge,
Daily Motion,https://www.dailymotion.com/video/x3slsrw,Nijidahuk,,Finger Family Teletubbies Family Finger Song Lollipop Popsicle Family Nursery Rhyme ( Dadd,
Daily Motion,https://www.dailymotion.com/video/x3slstl,Nijidahuk,,Finger Family Nursery Rhymes,
Daily Motion,https://www.dailymotion.com/video/x3slt1p,Nijidahuk,,Finger Family Teletubbies Family Finger Song Lollipop Popsicle Family Nursery Rhyme ( Dadd,
Daily Motion,https://www.dailymotion.com/video/x3snsmr,Nijidahuk,,PEPPA PIG Christmas Finger Family Nursery Rhymes Peppa Pig Daddy Finger Song,
Daily Motion,https://www.dailymotion.com/video/x3snst6,Nijidahuk,,Finger Family Nursery Rhymes,
Daily Motion,https://www.dailymotion.com/video/x3svg2n,Nijidahuk,,Thomas and Friends Finger Family | Nursery Rhymes,
Daily Motion,https://www.dailymotion.com/video/x3svgds,Nijidahuk,,Play Doh Peppa Pig Finger Family Song,
Daily Motion,https://www.dailymotion.com/video/x3s5us1,Nijidahuk,,The Little Einsteins Daddy Finger Family Sing-a-Song on Its Toy Time Tv,
Daily Motion,https://www.dailymotion.com/video/x3sbjzy,Nijidahuk,,Henry Hugglemonster Finger Family Nursery Rhymes Lyrics,
Daily Motion,https://www.dailymotion.com/video/x3sdrtg,Nijidahuk,,Sonic Boom Finger Family Song,
Daily Motion,https://www.dailymotion.com/video/x3sdrtk,Nijidahuk,,Finger Family Superheroes! Finger Family Song Batman Spiderman Hulk Finger Family Songs Da,
Daily Motion,https://www.dailymotion.com/video/x3sdrx2,Nijidahuk,,Ice age Finger Family Nursery Rhymes Ice age Finger Family Nursery Rhymes,
Daily Motion,https://www.dailymotion.com/video/x3sdrx6,Nijidahuk,,Jungle Junction Finger Family Nursery Rhymes Lyrics,
Daily Motion,https://www.dailymotion.com/video/x3sds0f,Nijidahuk,,Play-Doh Teletubbies Meadow Finger Family Nursery Rhyme Song,
Daily Motion,https://www.dailymotion.com/video/x3sds50,Nijidahuk,,Finger Family Sofia The First Family Nursery Rhyme,
Daily Motion,https://www.dailymotion.com/video/x3sdsax,Nijidahuk,,Adventure Time Finger Family Collection Adventure Time Finger Family Songs Nursery Rhymes,
Daily Motion,https://www.dailymotion.com/video/x3sg61v,Nijidahuk,,Peppa Pig Mafia Finger Family Nursery Rhyme Song,
Daily Motion,https://www.dailymotion.com/video/x3s0jj6,Nijidahuk,,Blues Clues Finger Family || Nursery Rhymes || From Doremi Songs Official,
Daily Motion,https://www.dailymotion.com/video/x3s0jqx,Nijidahuk,,Tayo the little Bus Finger Family Song Parody Nursery Rhyme,
Daily Motion,https://www.dailymotion.com/video/x3s3qbe,Nijidahuk,,Amazing World Of Gumball Mix n Match Finger Family Nursery Rhyme Song,
Daily Motion,https://www.dailymotion.com/video/x3s3qk7,Nijidahuk,,Sheriff Callies Wild West Finger Family Nursery Rhymes Lyrics,
Daily Motion,https://www.dailymotion.com/video/x3s3r78,Nijidahuk,,Scooby Doo Finger Family Collection Scooby Doo Finger Family Songs Scooby Doo Nursery Rhym,
Daily Motion,https://www.dailymotion.com/video/x3s5u5q,Nijidahuk,,Chuggington Cartoon Song | Finger Family Nursery Rhymes | Song For Children,
Daily Motion,https://www.dailymotion.com/video/x3s5ugs,Nijidahuk,,Thomas & Friends Finger Family Nursery Rhyme Song For Kids,
Daily Motion,https://www.dailymotion.com/video/x3s5uht,Nijidahuk,,Tickety Toc Finger Family Nursery Rhyme for Children,
Daily Motion,https://www.dailymotion.com/video/x3s5uja,Nijidahuk,,Angry Birds Movie | Finger Family nursery rhyme,
Daily Motion,https://www.dailymotion.com/video/x3s5up5,Nijidahuk,,Christmas Tree Finger Family Nursery Rhyme | Finger Family Songs,
Daily Motion,https://www.dailymotion.com/video/x3svgqb,Nijidahuk,,The Finger Family | Uncle Grandpa Finger Family Nursery Rhyme | Finger Family Songs HD,
Daily Motion,https://www.dailymotion.com/video/x3svgtv,Nijidahuk,,Paw Patrol Finger Family Songs | Nursery Rhymes for Children and Kids,
Daily Motion,https://www.dailymotion.com/video/x3t4wu0,Nijidahuk,,Masha and the Bear Finger Family Song Lollipop Nursery Rhyme,
Daily Motion,https://www.dailymotion.com/video/x3t4y24,Nijidahuk,,Finger Family Nursery Rhymes,
Daily Motion,https://www.dailymotion.com/video/x3t5146,Nijidahuk,,Bubble Guppies Finger Family Song and Nursery Rhymes for Children,
Daily Motion,https://www.dailymotion.com/video/x3t51ry,Nijidahuk,,BACKYARDIGANS - Finger Family Song [Nursery Rhyme] Toy SONG | Finger Family Fun,
Daily Motion,https://www.dailymotion.com/video/x3t51sy,Nijidahuk,,Little Einsteins Finger Family Nursery Rhymes Lyrics,
Daily Motion,https://www.dailymotion.com/video/x3t51v7,Nijidahuk,,Finding Nemo Finger Family Songs - Daddy Finger Nursery Rhymes Disney Pixar Collection 30,
Daily Motion,https://www.dailymotion.com/video/x3tdmoz,Nijidahuk,,Finger Family Nursery Rhymes,
Daily Motion,https://www.dailymotion.com/video/x3tdn5b,Nijidahuk,,Halloween Finger Family Song | Monster Finger Family Nursery Rhymes,
Daily Motion,https://www.dailymotion.com/video/x3qow6x,Team Umizoomi,,"Finger Family Collection - Dora the Explorer, Peppa Pig, Bubble Guppies, SpongeBob Compila",
Daily Motion,https://www.dailymotion.com/video/x3qpr77,Team Umizoomi,,Disney Dogs - Finger Family Song Nursery Rhymes - Dogs Family Finger,
Daily Motion,https://www.dailymotion.com/video/x28qfex,Yagmur Taşan,,The Smile Song,
Daily Motion,https://www.dailymotion.com/video/x2971sr,RedFlutterMao,,Smile song - Tombstone Mix [Typography Animation],
Daily Motion,https://www.dailymotion.com/video/x2o7y6x,Tomoko Trout,,Smile song - Tombstone Mix [Typography Animation/PMV],
Daily Motion,https://www.dailymotion.com/video/x2rlhum,Hernan Brown,,Pinkie Pie Smile Lyrics,
Daily Motion,https://www.dailymotion.com/video/x2zxx8f,scottishgeeks,,My Little Pony | Smile exe,
Daily Motion,https://www.dailymotion.com/video/x356plr,Lonnie Forrest,,Pinkie Pie smile HD,
Daily Motion,https://www.dailymotion.com/video/x366to5,V Music,,Katy Pony - Part Of Me (My Little Pony Music Video),
Daily Motion,https://www.dailymotion.com/video/x3a0m6e,Desavase61,,My Little Pony- Equestria Girls - Rainbow Rocks Episode 2,
Daily Motion,https://www.dailymotion.com/video/x3tdnbk,Nijidahuk,,THE INCREDIBLES Finger Family Nursery Song by MY FINGER FAMILY for kids,
Daily Motion,https://www.dailymotion.com/video/x3tdnkx,Nijidahuk,,"Finger Family Special Christmas - Dora, Diego, Team Umizoomi, Bubble Guppies Finger Song",
Daily Motion,https://www.dailymotion.com/video/x3tdnpi,Nijidahuk,,Chuggington Finger Family Nursery Rhymes Lyrics,
Daily Motion,https://www.dailymotion.com/video/x3tdnrj,Nijidahuk,,"Paw Patrol Finger Family Songs, Nick Jr. - Daddy Finger Nursery Rhymes Collection 30 minut",
Daily Motion,https://www.dailymotion.com/video/x3tdo4i,Nijidahuk,,Team Umizoomi Finger Family Nursery Rhyme Song Play Doh,
Daily Motion,https://www.dailymotion.com/video/x3tdocu,Nijidahuk,,Lego Superheroes Finger Family Nursery Rhymes,
Daily Motion,https://www.dailymotion.com/video/x3tgrbf,Nijidahuk,,CARS Movie Cartoon NEW Finger Family Song Nursery Rhymes,
Daily Motion,https://www.dailymotion.com/video/x3tgrl7,Nijidahuk,,Little Einsteins Finger Family Nursery Rhymes Lyrics,
Daily Motion,https://www.dailymotion.com/video/x3s7e2n,Rinace,,"Minions Finger Family Song! Minions Dinosaur Finger Family Song, Daddy Finger Song Minions",
Daily Motion,https://www.dailymotion.com/video/x3qmnls,Team Umizoomi,,Dinosaur Finger Family Song - Nursery Rhymes Dinosaur Family Finger,
